{"$id":"https://randle.local/schemas/operational-package-interface/4.0.0-DRAFT","$schema":"https://json-schema.org/draft/2020-12/schema","additionalProperties":false,"properties":{"accepted_specification_interface_version":{"const":"RANDLE-BASELINE-BOUNDARY-4"},"authority":{"const":"DRAFT_INTERFACE_ONLY_PENDING_SEPARATE_AUTHORSHIP_AND_REVIEW"},"canonical_serialization":{"const":"RANDLE-CAPTURE-CJSON-1"},"compatibility_requirements":{"items":{"type":"string"},"minItems":1,"type":"array"},"future_operational_package_required_fields":{"items":{"type":"string"},"minItems":1,"type":"array","uniqueItems":true},"positive_operational_states_forbidden":{"const":true},"schema_version":{"const":"4.0.0-DRAFT"},"self_referential_specification_and_package_identity_forbidden":{"const":true}},"required":["accepted_specification_interface_version","authority","canonical_serialization","compatibility_requirements","future_operational_package_required_fields","positive_operational_states_forbidden","schema_version","self_referential_specification_and_package_identity_forbidden"],"type":"object"}
