{"accepted_specification_interface_version":"RANDLE-BASELINE-BOUNDARY-4","authority":"DRAFT_INTERFACE_ONLY_PENDING_SEPARATE_AUTHORSHIP_AND_REVIEW","canonical_serialization":"RANDLE-CAPTURE-CJSON-1","compatibility_requirements":["ACCEPTED_SPECIFICATION_IDENTITY_IMMUTABLE","OPERATIONAL_PACKAGE_IDENTITY_DISTINCT","PACKAGE_REVIEW_DECISION_ACCEPTED","SCRIPT_RAW_AND_GIT_IDENTITIES_MATCH","FREEZE_BINDS_BOTH_AUTHORITIES"],"future_operational_package_required_fields":["package_commit_or_content_address","package_parent","package_tree","package_manifest_sha256","operational_script_git_blob","operational_script_raw_sha256","supporting_module_identities","package_review_receipt_sha256","independent_review_decision","accepted_specification_commit","accepted_specification_interface_version","freeze_package_identity"],"positive_operational_states_forbidden":true,"schema_version":"4.0.0-DRAFT","self_referential_specification_and_package_identity_forbidden":true}
